{
  "version": "1.1.0",
  "authoritative": true,
  "nodeCount": 49,
  "notes": "N01 明确副业目标已退役；活动节点 N02—N50，编号保留以兼容历史数据。",
  "nodes": [
    {
      "id": "N02",
      "ordinal": 1,
      "name": "盘点自身条件",
      "stage": "FOUNDATION",
      "responsibility": "B",
      "scope": "ACCOUNT",
      "dependsOn": [],
      "agentRole": "POSITIONING",
      "recommendedCapabilities": [
        "TEXT_REASONING"
      ],
      "executorKind": "AGENT",
      "applicability": "所有路线适用",
      "inputDescription": "真实能力、经历、可用设备和素材",
      "output": {
        "artifactType": "RESOURCE_PROFILE",
        "requiredFields": [
          "skills",
          "experiences",
          "resources",
          "privacyBoundaries"
        ]
      },
      "acceptanceCriteria": "明确哪些是事实、哪些可公开",
      "humanAction": "补充真实经历及隐私边界",
      "reworkAction": "补充资源事实，重新评估可执行性",
      "manualFallback": "上传或填写同类型产物并补齐来源、版本、制作方式和检查记录；不伪造执行成功。",
      "implementationStatus": "DESIGNED"
    },
    {
      "id": "N03",
      "ordinal": 2,
      "name": "确定目标观众",
      "stage": "FOUNDATION",
      "responsibility": "B",
      "scope": "ACCOUNT",
      "dependsOn": [
        "N02"
      ],
      "agentRole": "POSITIONING",
      "recommendedCapabilities": [
        "TEXT_REASONING"
      ],
      "executorKind": "AGENT",
      "applicability": "所有路线适用",
      "inputDescription": "创作目标、资源与公开需求线索",
      "output": {
        "artifactType": "AUDIENCE_PROFILE",
        "requiredFields": [
          "segments",
          "problems",
          "evidenceRefs"
        ]
      },
      "acceptanceCriteria": "受众足够具体，需求有证据或标为假设",
      "humanAction": "选择愿意长期服务的受众",
      "reworkAction": "补采证据或调整人群假设",
      "manualFallback": "上传或填写同类型产物并补齐来源、版本、制作方式和检查记录；不伪造执行成功。",
      "implementationStatus": "DESIGNED"
    },
    {
      "id": "N04",
      "ordinal": 3,
      "name": "确定账号定位",
      "stage": "FOUNDATION",
      "responsibility": "C",
      "scope": "ACCOUNT",
      "dependsOn": [
        "N03"
      ],
      "agentRole": "POSITIONING",
      "recommendedCapabilities": [
        "TEXT_REASONING"
      ],
      "executorKind": "AGENT",
      "applicability": "所有路线适用",
      "inputDescription": "目标、人群、资源、差异方案",
      "output": {
        "artifactType": "POSITIONING",
        "requiredFields": [
          "audience",
          "valuePromise",
          "credibility",
          "limitations"
        ]
      },
      "acceptanceCriteria": "定位可解释且有真实支撑",
      "humanAction": "决定对外身份和长期方向",
      "reworkAction": "更新定位版本，已发布内容保留历史",
      "manualFallback": "上传或填写同类型产物并补齐来源、版本、制作方式和检查记录；不伪造执行成功。",
      "implementationStatus": "DESIGNED"
    },
    {
      "id": "N05",
      "ordinal": 4,
      "name": "设计内容栏目",
      "stage": "FOUNDATION",
      "responsibility": "B",
      "scope": "ACCOUNT",
      "dependsOn": [
        "N04"
      ],
      "agentRole": "POSITIONING",
      "recommendedCapabilities": [
        "TEXT_REASONING"
      ],
      "executorKind": "AGENT",
      "applicability": "所有路线适用",
      "inputDescription": "定位、素材供给与时间预算",
      "output": {
        "artifactType": "CONTENT_PILLARS",
        "requiredFields": [
          "pillars",
          "topicExamples",
          "productionConstraints"
        ]
      },
      "acceptanceCriteria": "栏目能持续生产并有选题样例",
      "humanAction": "选择栏目与制作负担",
      "reworkAction": "合并过重栏目，保留历史归属",
      "manualFallback": "上传或填写同类型产物并补齐来源、版本、制作方式和检查记录；不伪造执行成功。",
      "implementationStatus": "DESIGNED"
    },
    {
      "id": "N06",
      "ordinal": 5,
      "name": "建立账号主页",
      "stage": "FOUNDATION",
      "responsibility": "B",
      "scope": "ACCOUNT",
      "dependsOn": [
        "N04"
      ],
      "agentRole": "PACKAGING",
      "recommendedCapabilities": [
        "TEXT_REASONING",
        "IMAGE_GENERATION"
      ],
      "executorKind": "AGENT",
      "applicability": "所有路线适用",
      "inputDescription": "已确认定位和用户持有账号",
      "output": {
        "artifactType": "ACCOUNT_PROFILE",
        "requiredFields": [
          "platforms",
          "profileDrafts",
          "identityStatus"
        ]
      },
      "acceptanceCriteria": "公开信息一致，认证状态如实记录",
      "humanAction": "身份操作及公开信息确认",
      "reworkAction": "修改公开资料，平台生效状态另行记录",
      "manualFallback": "上传或填写同类型产物并补齐来源、版本、制作方式和检查记录；不伪造执行成功。",
      "implementationStatus": "DESIGNED"
    },
    {
      "id": "N07",
      "ordinal": 6,
      "name": "建立制作规范",
      "stage": "FOUNDATION",
      "responsibility": "B",
      "scope": "ACCOUNT",
      "dependsOn": [
        "N05",
        "N06"
      ],
      "agentRole": "ART_CONTINUITY",
      "recommendedCapabilities": [
        "TEXT_REASONING",
        "VISION_UNDERSTANDING"
      ],
      "executorKind": "AGENT",
      "applicability": "所有路线适用",
      "inputDescription": "栏目、主页、风格和制作条件",
      "output": {
        "artifactType": "PRODUCTION_STANDARD",
        "requiredFields": [
          "visualRules",
          "audioRules",
          "fileRules",
          "qualityRules"
        ]
      },
      "acceptanceCriteria": "样式、目录和质量规则可执行",
      "humanAction": "选择参考样片与规范",
      "reworkAction": "修订规范，只影响后续或显式迁移项目",
      "manualFallback": "上传或填写同类型产物并补齐来源、版本、制作方式和检查记录；不伪造执行成功。",
      "implementationStatus": "DESIGNED"
    },
    {
      "id": "N08",
      "ordinal": 7,
      "name": "捕捉原始想法",
      "stage": "IDEATION",
      "responsibility": "B",
      "scope": "IDEA",
      "dependsOn": [],
      "agentRole": "TOPIC_RESEARCH",
      "recommendedCapabilities": [
        "TEXT_REASONING",
        "ASR"
      ],
      "executorKind": "AGENT",
      "applicability": "所有路线适用",
      "inputDescription": "用户文字、语音或随手记录",
      "output": {
        "artifactType": "RAW_IDEA",
        "requiredFields": [
          "rawContent",
          "inputMode",
          "capturedAt"
        ]
      },
      "acceptanceCriteria": "保留原始记录且整理不改变原意",
      "humanAction": "提供原始想法",
      "reworkAction": "回到原文纠正转写或理解",
      "manualFallback": "上传或填写同类型产物并补齐来源、版本、制作方式和检查记录；不伪造执行成功。",
      "implementationStatus": "DESIGNED"
    },
    {
      "id": "N09",
      "ordinal": 8,
      "name": "解释想法的来源",
      "stage": "IDEATION",
      "responsibility": "B",
      "scope": "IDEA",
      "dependsOn": [
        "N08"
      ],
      "agentRole": "TOPIC_RESEARCH",
      "recommendedCapabilities": [
        "TEXT_REASONING"
      ],
      "executorKind": "AGENT",
      "applicability": "所有路线适用",
      "inputDescription": "原始想法及用户补充",
      "output": {
        "artifactType": "IDEA_CONTEXT",
        "requiredFields": [
          "trigger",
          "realScenario",
          "knownFacts",
          "openQuestions"
        ]
      },
      "acceptanceCriteria": "事实与推测区分",
      "humanAction": "补充真实触发场景",
      "reworkAction": "追问缺失背景，禁止编造亲历",
      "manualFallback": "上传或填写同类型产物并补齐来源、版本、制作方式和检查记录；不伪造执行成功。",
      "implementationStatus": "DESIGNED"
    },
    {
      "id": "N10",
      "ordinal": 9,
      "name": "翻译成观众问题",
      "stage": "IDEATION",
      "responsibility": "B",
      "scope": "IDEA",
      "dependsOn": [
        "N09",
        "N03"
      ],
      "agentRole": "TOPIC_RESEARCH",
      "recommendedCapabilities": [
        "TEXT_REASONING"
      ],
      "executorKind": "AGENT",
      "applicability": "所有路线适用",
      "inputDescription": "想法背景与已批准受众版本",
      "output": {
        "artifactType": "AUDIENCE_PROBLEM",
        "requiredFields": [
          "audience",
          "scenario",
          "problem",
          "expectedBenefit"
        ]
      },
      "acceptanceCriteria": "问题具体且未偏离想法",
      "humanAction": "确认表达意图",
      "reworkAction": "重新限定人群、场景和收益",
      "manualFallback": "上传或填写同类型产物并补齐来源、版本、制作方式和检查记录；不伪造执行成功。",
      "implementationStatus": "DESIGNED"
    },
    {
      "id": "N11",
      "ordinal": 10,
      "name": "验证需求",
      "stage": "IDEATION",
      "responsibility": "B",
      "scope": "IDEA",
      "dependsOn": [
        "N10"
      ],
      "agentRole": "TOPIC_RESEARCH",
      "recommendedCapabilities": [
        "TEXT_REASONING"
      ],
      "executorKind": "AGENT",
      "applicability": "所有路线适用",
      "inputDescription": "问题、允许读取的公开来源或人工导入",
      "output": {
        "artifactType": "DEMAND_EVIDENCE",
        "requiredFields": [
          "sources",
          "observations",
          "sampleLimits",
          "hypotheses"
        ]
      },
      "acceptanceCriteria": "来源可追溯，样本局限明确",
      "humanAction": "判断证据是否足够",
      "reworkAction": "补采或降低需求结论强度",
      "manualFallback": "上传或填写同类型产物并补齐来源、版本、制作方式和检查记录；不伪造执行成功。",
      "implementationStatus": "DESIGNED"
    },
    {
      "id": "N12",
      "ordinal": 11,
      "name": "分析已有内容",
      "stage": "IDEATION",
      "responsibility": "B",
      "scope": "IDEA",
      "dependsOn": [
        "N11"
      ],
      "agentRole": "TOPIC_RESEARCH",
      "recommendedCapabilities": [
        "TEXT_REASONING",
        "VISION_UNDERSTANDING"
      ],
      "executorKind": "AGENT",
      "applicability": "所有路线适用",
      "inputDescription": "授权访问的参考内容及其链接",
      "output": {
        "artifactType": "REFERENCE_ANALYSIS",
        "requiredFields": [
          "references",
          "comparison",
          "unansweredQuestions"
        ]
      },
      "acceptanceCriteria": "比较有依据，不抄袭表达和素材",
      "humanAction": "判断有价值的差异",
      "reworkAction": "修订比较维度或替换参考样本",
      "manualFallback": "上传或填写同类型产物并补齐来源、版本、制作方式和检查记录；不伪造执行成功。",
      "implementationStatus": "DESIGNED"
    },
    {
      "id": "N13",
      "ordinal": 12,
      "name": "选择自己的切入点",
      "stage": "IDEATION",
      "responsibility": "B",
      "scope": "IDEA",
      "dependsOn": [
        "N12"
      ],
      "agentRole": "TOPIC_RESEARCH",
      "recommendedCapabilities": [
        "TEXT_REASONING"
      ],
      "executorKind": "AGENT",
      "applicability": "所有路线适用",
      "inputDescription": "需求、同类比较和自身条件",
      "output": {
        "artifactType": "ANGLE_OPTIONS",
        "requiredFields": [
          "options",
          "evidence",
          "productionEstimates",
          "recommendation"
        ]
      },